{
  "kind": "EASI.PipelineExecutionResult",
  "version": "1.0.0",
  "mode": "process",
  "status": "success",
  "startedAt": "2026-04-26T12:00:00Z",
  "endedAt": "2026-04-26T12:00:01Z",
  "durationMs": 1000,
  "iterations": 1,
  "resultCollection": {
    "resultType": "PipelineResultCollection",
    "count": 1,
    "isEmpty": false,
    "items": [
      {
        "resourceType": "ImagingStudy"
      }
    ]
  },
  "operationResults": [
    {
      "kind": "EASI.PipelineOperationResult",
      "version": "1.0.0",
      "operation": "into",
      "category": "writer",
      "writer": "HttpStreamWriter",
      "materialized": false,
      "bytesWritten": 1024,
      "payload": null,
      "output": {
        "statusCode": 200
      }
    }
  ],
  "trace": null,
  "diagnostics": [],
  "error": null,
  "metrics": {
    "bytesRead": 2048,
    "bytesWritten": 1024,
    "resultCount": 1,
    "errorCount": 0,
    "warningCount": 0
  }
}
